{
    "prompt": "An ice cube is melting.",
    "negative_prompt": "lowres, text, error, cropped, worst quality, low quality, jpeg artifacts, ugly, duplicate, morbid, mutilated, out of frame, extra fingers, mutated hands, poorly drawn hands, poorly drawn face, mutation, deformed, blurry, dehydrated, bad anatomy, bad proportions, extra limbs, cloned face, disfigured, gross proportions, malformed limbs, missing arms, missing legs, extra arms, extra legs, fused fingers, too many fingers, long neck, username, watermark, signature",
    "width": 512,
    "height": 512,
    "num_inference_steps": 25,
    "guidance_scale": 8.5,
    "video_length": 16
  }